CODIGO,CLAVE,DIRECCION,CMUN,DESCR,UTM_X,UTM_Y,BUSCA,DS_ABREV,DS_LARGO,ETIQUETA,URL,MUNICIPIO,CD_VIAL
28058676,IES,"Paseo del Olivar, 62",004,El Álamo,416328,4453544,"Instituto de Educación Secundaria IES El Álamo. Paseo del Olivar, 62. Álamo (El)",IES,Instituto de Educación Secundaria,IES El Álamo,https://gestiona.comunidad.madrid/wpad_pub/run/j/MostrarFichaCentro.icm?cdCentro=28058676,Álamo (El),00400383
28058688,IES,"Calle Miguel Hernández, 2 A",149,Miguel Delibes,431485,4449552,"Instituto de Educación Secundaria IES Miguel Delibes. Calle Miguel Hernández, 2 A. Torrejón de la Calzada",IES,Instituto de Educación Secundaria,IES Miguel Delibes,https://gestiona.comunidad.madrid/wpad_pub/run/j/MostrarFichaCentro.icm?cdCentro=28058688,Torrejón de la Calzada,14900155
28058718,CEIP,"Calle Salvador Dalí, 8. (Los Hueros)",172,Salvador Dalí,470236,4477649,"Colegio Infantil y Primaria CEIP Salvador Dalí. Calle Salvador Dalí, 8. (Los Hueros). Villalbilla",CP INF-PRI,Colegio Infantil y Primaria,CEIP Salvador Dalí,https://gestiona.comunidad.madrid/wpad_pub/run/j/MostrarFichaCentro.icm?cdCentro=28058718,Villalbilla,17200354
28058731,EOI,"Calle Manuel Hernández Mompo, 2",113,de Pinto,440471,4456433,"Escuela Oficial Idiomas EOI de Pinto. Calle Manuel Hernández Mompo, 2. Pinto",EOI,Escuela Oficial Idiomas,EOI de Pinto,https://gestiona.comunidad.madrid/wpad_pub/run/j/MostrarFichaCentro.icm?cdCentro=28058731,Pinto,113C0004
28058809,EEI,"Calle Espino, 6",004,Pasemisí,415562,4454099,"Escuela de Educación Infantil EEI Pasemisí. Calle Espino, 6. Álamo (El)",EEI-CN,Escuela de Educación Infantil,EEI Pasemisí,https://gestiona.comunidad.madrid/wpad_pub/run/j/MostrarFichaCentro.icm?cdCentro=28058809,Álamo (El),00400366
28058822,CEIP,"Calle José Saramago, 2A",123,José Saramago,454704,4467196,"Colegio Infantil y Primaria CEIP José Saramago. Calle José Saramago, 2A. Rivas-Vaciamadrid",CP INF-PRI,Colegio Infantil y Primaria,CEIP José Saramago,https://gestiona.comunidad.madrid/wpad_pub/run/j/MostrarFichaCentro.icm?cdCentro=28058822,Rivas-Vaciamadrid,12300693
28058895,EEI,"Calle Eras, 2",158,El Cancionero,444257,4524582,"Escuela de Educación Infantil EEI El Cancionero. Calle Eras, 2. Valdemanco",EEI-CN,Escuela de Educación Infantil,EEI El Cancionero,https://gestiona.comunidad.madrid/wpad_pub/run/j/MostrarFichaCentro.icm?cdCentro=28058895,Valdemanco,158A0017
28058901,EEI,"Paseo Estación, 12",174,La Estación,405394,4461154,"Escuela de Educación Infantil EEI La Estación. Paseo Estación, 12. Villamanta",EEI-CN,Escuela de Educación Infantil,EEI La Estación,https://gestiona.comunidad.madrid/wpad_pub/run/j/MostrarFichaCentro.icm?cdCentro=28058901,Villamanta,174A0026
28058913,EEI,"Calle Talamanca, 5",168,El Vellón,451054,4513214,"Escuela de Educación Infantil EEI El Vellón. Calle Talamanca, 5. Vellón (El)",EEI-CN,Escuela de Educación Infantil,EEI El Vellón,https://gestiona.comunidad.madrid/wpad_pub/run/j/MostrarFichaCentro.icm?cdCentro=28058913,Vellón (El),16800054
28058925,EEI,"Calle Murillo, 4",026,Prado Alto,415685,4473334,"Escuela de Educación Infantil EEI Prado Alto. Calle Murillo, 4. Brunete",EEI,Escuela de Educación Infantil,EEI Prado Alto,https://gestiona.comunidad.madrid/wpad_pub/run/j/MostrarFichaCentro.icm?cdCentro=28058925,Brunete,02600309
28058937,EEI,"Avda Juan Carlos I, 26",065,El Duende,436294,4459842,"Escuela de Educación Infantil EEI El Duende. Avda Juan Carlos I, 26. Getafe",EEI-CN,Escuela de Educación Infantil,EEI El Duende,https://gestiona.comunidad.madrid/wpad_pub/run/j/MostrarFichaCentro.icm?cdCentro=28058937,Getafe,065A0415
28059279,IES,"Calle Elisadero, 28",125,Sabino Fernández Campo,395333,4483816,"Instituto de Educación Secundaria IES Sabino Fernández Campo. Calle Elisadero, 28. Robledo de Chavela",IES,Instituto de Educación Secundaria,IES Sabino Fernández Campo,https://gestiona.comunidad.madrid/wpad_pub/run/j/MostrarFichaCentro.icm?cdCentro=28059279,Robledo de Chavela,12500314
28059280,EA,"Avda Felicidad, 27",079,Victoria de los Ángeles,441551,4467919,"Escuela de Educación Artística EA Victoria de los Ángeles. Avda Felicidad, 27. Madrid",CPROF MUS,Escuela de Educación Artística,EA Victoria de los Ángeles,https://gestiona.comunidad.madrid/wpad_pub/run/j/MostrarFichaCentro.icm?cdCentro=28059280,Madrid,07911851
28059292,EA,"Avda Felicidad, 27",079,Carmen Amaya,441488,4467918,"Escuela de Educación Artística EA Carmen Amaya. Avda Felicidad, 27. Madrid",CPROF DANZA,Escuela de Educación Artística,EA Carmen Amaya,https://gestiona.comunidad.madrid/wpad_pub/run/j/MostrarFichaCentro.icm?cdCentro=28059292,Madrid,07911851
28059309,EOI,"Avda Juan XXIII, 4",115,Pozuelo de Alarcón,432105,4478002,"Escuela Oficial Idiomas EOI Pozuelo de Alarcón. Avda Juan XXIII, 4. Pozuelo de Alarcón",EOI,Escuela Oficial Idiomas,EOI Pozuelo de Alarcón,https://gestiona.comunidad.madrid/wpad_pub/run/j/MostrarFichaCentro.icm?cdCentro=28059309,Pozuelo de Alarcón,115A0394
28059310,EOI,"Calle Picos de Urbión, s/n c/v Calle Jaén, 1",123,Rivas-Vaciamadrid,455182,4469390,"Escuela Oficial Idiomas EOI Rivas-Vaciamadrid. Calle Picos de Urbión, s/n c/v Calle Jaén, 1. Rivas-Vaciamadrid",EOI,Escuela Oficial Idiomas,EOI Rivas-Vaciamadrid,https://gestiona.comunidad.madrid/wpad_pub/run/j/MostrarFichaCentro.icm?cdCentro=28059310,Rivas-Vaciamadrid,12314606
28059361,CEPA,"Calle De San Bernardo (Edificio I.E.S Lope De Vega), 70",079,Distrito Centro,440079,4475378,"Centro Educación de Adultos CEPA Distrito Centro. Calle De San Bernardo (Edificio I.E.S Lope De Vega), 70. Madrid",CEPA,Centro Educación de Adultos,CEPA Distrito Centro,https://gestiona.comunidad.madrid/wpad_pub/run/j/MostrarFichaCentro.icm?cdCentro=28059361,Madrid,07905386
28059371,CEPA,"Calle Real, 7",176,La Mesta,414711,4478172,"Centro Educación de Adultos CEPA La Mesta. Calle Real, 7. Villanueva de la Cañada",CEPA,Centro Educación de Adultos,CEPA La Mesta,https://gestiona.comunidad.madrid/wpad_pub/run/j/MostrarFichaCentro.icm?cdCentro=28059371,Villanueva de la Cañada,176A0172
28059383,CEPA,"Carrera Guadarrama, 85",061,La Oreja Verde,414589,4492937,"Centro Educación de Adultos CEPA La Oreja Verde. Carrera Guadarrama, 85. Galapagar",CEPA,Centro Educación de Adultos,CEPA La Oreja Verde,https://gestiona.comunidad.madrid/wpad_pub/run/j/MostrarFichaCentro.icm?cdCentro=28059383,Galapagar,061A0273
28059395,CEPA,"Avda Torrelodones, 8",152,Almajan,420046,4492207,"Centro Educación de Adultos CEPA Almajan. Avda Torrelodones, 8. Torrelodones",CEPA,Centro Educación de Adultos,CEPA Almajan,https://gestiona.comunidad.madrid/wpad_pub/run/j/MostrarFichaCentro.icm?cdCentro=28059395,Torrelodones,152C0031
28059401,CEPA,"Calle Fuente de Arriba, 1",027,Buitrago de Lozoya,446299,4538173,"Centro Educación de Adultos CEPA Buitrago de Lozoya. Calle Fuente de Arriba, 1. Buitrago del Lozoya",CEPA,Centro Educación de Adultos,CEPA Buitrago de Lozoya,https://gestiona.comunidad.madrid/wpad_pub/run/j/MostrarFichaCentro.icm?cdCentro=28059401,Buitrago del Lozoya,027A0038
28059437,EEI,"Avda Madrid, 30",137,Baobab,478144,4483352,"Escuela de Educación Infantil EEI Baobab. Avda Madrid, 30. Santos de la Humosa (Los)",EEI-CN,Escuela de Educación Infantil,EEI Baobab,https://gestiona.comunidad.madrid/wpad_pub/run/j/MostrarFichaCentro.icm?cdCentro=28059437,Santos de la Humosa (Los),13700162
28059449,EEI,"Avda Ángeles, 26",065,Acuarela,438843,4462325,"Escuela de Educación Infantil EEI Acuarela. Avda Ángeles, 26. Getafe",EEI-CN,Escuela de Educación Infantil,EEI Acuarela,https://gestiona.comunidad.madrid/wpad_pub/run/j/MostrarFichaCentro.icm?cdCentro=28059449,Getafe,065A0060
28059450,EEI,"Camino de Torrejón de Velasco, 5",036,Casarrubuelos Nº 2,429373,4447188,"Escuela de Educación Infantil EEI Casarrubuelos Nº 2. Camino de Torrejón de Velasco, 5. Casarrubuelos",EEI-CN,Escuela de Educación Infantil,EEI Casarrubuelos Nº 2,https://gestiona.comunidad.madrid/wpad_pub/run/j/MostrarFichaCentro.icm?cdCentro=28059450,Casarrubuelos,03600267
28059462,EEI,"Calle Señora Sergia, s/n c/v Calle Nueva, 20",152,Las Ardillas,421185,4492616,"Escuela de Educación Infantil EEI Las Ardillas. Calle Señora Sergia, s/n c/v Calle Nueva, 20. Torrelodones",EEI,Escuela de Educación Infantil,EEI Las Ardillas,https://gestiona.comunidad.madrid/wpad_pub/run/j/MostrarFichaCentro.icm?cdCentro=28059462,Torrelodones,15200546
28059589,EEI,"Calle Madrid, 38",044,Las Casitas,414187,4490079,"Escuela de Educación Infantil EEI Las Casitas. Calle Madrid, 38. Colmenarejo",EEI,Escuela de Educación Infantil,EEI Las Casitas,https://gestiona.comunidad.madrid/wpad_pub/run/j/MostrarFichaCentro.icm?cdCentro=28059589,Colmenarejo,04400115
28059929,EA,"Avda Cabrera, 96",030,La Cabrera,448907,4524828,"Escuela de Educación Artística EA La Cabrera. Avda Cabrera, 96. Cabrera (La)",E MUN. MUS-DANZA,Escuela de Educación Artística,EA La Cabrera,https://gestiona.comunidad.madrid/wpad_pub/run/j/MostrarFichaCentro.icm?cdCentro=28059929,Cabrera (La),03000116
28059930,EA,"Calle Ronda de Las Cuestas, 39",104,Paracuellos de Jarama,454806,4484001,"Escuela de Educación Artística EA Paracuellos de Jarama. Calle Ronda de Las Cuestas, 39. Paracuellos de Jarama",E MUN.MUSICA,Escuela de Educación Artística,EA Paracuellos de Jarama,https://gestiona.comunidad.madrid/wpad_pub/run/j/MostrarFichaCentro.icm?cdCentro=28059930,Paracuellos de Jarama,10400045
28059942,EA,"Calle Paz, s/n (Casa de Cultura Giralt Laporta)",160,Valdemorillo,409742,4483941,"Escuela de Educación Artística EA Valdemorillo. Calle Paz, s/n (Casa de Cultura Giralt Laporta). Valdemorillo",E MUN. MUS-DANZA,Escuela de Educación Artística,EA Valdemorillo,https://gestiona.comunidad.madrid/wpad_pub/run/j/MostrarFichaCentro.icm?cdCentro=28059942,Valdemorillo,16000792
28059954,EA,Calle Carlos V c/v Calle Lepanto,054,El Escorial,404085,4492707,Escuela de Educación Artística EA El Escorial. Calle Carlos V c/v Calle Lepanto. Escorial (El),E MUN. MUS-DANZA,Escuela de Educación Artística,EA El Escorial,https://gestiona.comunidad.madrid/wpad_pub/run/j/MostrarFichaCentro.icm?cdCentro=28059954,Escorial (El),05400688
28060208,EOI,"Calle San Fernando, 1",148,Torrejón de Ardoz,458692,4479040,"Escuela Oficial Idiomas EOI Torrejón de Ardoz. Calle San Fernando, 1. Torrejón de Ardoz",EOI,Escuela Oficial Idiomas,EOI Torrejón de Ardoz,https://gestiona.comunidad.madrid/wpad_pub/run/j/MostrarFichaCentro.icm?cdCentro=28060208,Torrejón de Ardoz,14800145
28060211,CEIP,"Calle Marmolina, 5",079,Pedro Duque,448475,4472017,"Colegio Infantil y Primaria CEIP Pedro Duque. Calle Marmolina, 5. Madrid",CP INF-PRI,Colegio Infantil y Primaria,CEIP Pedro Duque,https://gestiona.comunidad.madrid/wpad_pub/run/j/MostrarFichaCentro.icm?cdCentro=28060211,Madrid,07945840
28060221,CEIP,"Calle Estefanita, 7",079,El Greco,442720,4466323,"Colegio Infantil y Primaria CEIP El Greco. Calle Estefanita, 7. Madrid",CP INF-PRI,Colegio Infantil y Primaria,CEIP El Greco,https://gestiona.comunidad.madrid/wpad_pub/run/j/MostrarFichaCentro.icm?cdCentro=28060221,Madrid,07945800
28060233,CEIP,"Calle Francisco Largo Caballero, s/n",006,Bachiller Alonso López,444510,4489401,"Colegio Infantil y Primaria CEIP Bachiller Alonso López. Calle Francisco Largo Caballero, s/n. Alcobendas",CP INF-PRI,Colegio Infantil y Primaria,CEIP Bachiller Alonso López,https://gestiona.comunidad.madrid/wpad_pub/run/j/MostrarFichaCentro.icm?cdCentro=28060233,Alcobendas,006E0040
28060245,CEIP,"Calle Andalucía, 8",015,Las Castañeras,421900,4458588,"Colegio Infantil y Primaria CEIP Las Castañeras. Calle Andalucía, 8. Arroyomolinos",CP INF-PRI,Colegio Infantil y Primaria,CEIP Las Castañeras,https://gestiona.comunidad.madrid/wpad_pub/run/j/MostrarFichaCentro.icm?cdCentro=28060245,Arroyomolinos,01500237
28060257,CEIP,"Calle Eucalipto, 37",092,Leonardo Da Vinci,421407,4462765,"Colegio Infantil y Primaria CEIP Leonardo Da Vinci. Calle Eucalipto, 37. Móstoles",CP INF-PRI,Colegio Infantil y Primaria,CEIP Leonardo Da Vinci,https://gestiona.comunidad.madrid/wpad_pub/run/j/MostrarFichaCentro.icm?cdCentro=28060257,Móstoles,092A0131
28060269,CEIP,"Calle Miguel Indurain, s/n",026,Ágora,415533,4473530,"Colegio Infantil y Primaria CEIP Ágora. Calle Miguel Indurain, s/n. Brunete",CP INF-PRI,Colegio Infantil y Primaria,CEIP Ágora,https://gestiona.comunidad.madrid/wpad_pub/run/j/MostrarFichaCentro.icm?cdCentro=28060269,Brunete,02600342
28060270,CEIPS,"Calle Tia Javiera, 6",058,Salvador Dalí,428421,4461790,"Colegio Infantil, Primaria y Secundaria CEIPS Salvador Dalí. Calle Tia Javiera, 6. Fuenlabrada",CP INF-PRI-SEC,"Colegio Infantil, Primaria y Secundaria",CEIPS Salvador Dalí,https://gestiona.comunidad.madrid/wpad_pub/run/j/MostrarFichaCentro.icm?cdCentro=28060270,Fuenlabrada,058A0466
28060282,CEIP,"Calle Rosalía de Castro, 2",161,Doña Leonor del Álamo,441292,4449653,"Colegio Infantil y Primaria CEIP Doña Leonor del Álamo. Calle Rosalía de Castro, 2. Valdemoro",CP INF-PRI,Colegio Infantil y Primaria,CEIP Doña Leonor del Álamo,https://gestiona.comunidad.madrid/wpad_pub/run/j/MostrarFichaCentro.icm?cdCentro=28060282,Valdemoro,161C0053
28060294,CEIP,"Calle Timanfaya, 1",040,Eloy Saavedra,446619,4444912,"Colegio Infantil y Primaria CEIP Eloy Saavedra. Calle Timanfaya, 1. Ciempozuelos",CP INF-PRI,Colegio Infantil y Primaria,CEIP Eloy Saavedra,https://gestiona.comunidad.madrid/wpad_pub/run/j/MostrarFichaCentro.icm?cdCentro=28060294,Ciempozuelos,04010016
28060300,CEIP,"Calle Arturo Soria, 3",005,La Garena,467116,4481476,"Colegio Infantil y Primaria CEIP La Garena. Calle Arturo Soria, 3. Alcalá de Henares",CP INF-PRI,Colegio Infantil y Primaria,CEIP La Garena,https://gestiona.comunidad.madrid/wpad_pub/run/j/MostrarFichaCentro.icm?cdCentro=28060300,Alcalá de Henares,00500730
28060312,CEIP,"Calle Federica Montseny, 3",123,Dulce Chacón,456292,4465139,"Colegio Infantil y Primaria CEIP Dulce Chacón. Calle Federica Montseny, 3. Rivas-Vaciamadrid",CP INF-PRI,Colegio Infantil y Primaria,CEIP Dulce Chacón,https://gestiona.comunidad.madrid/wpad_pub/run/j/MostrarFichaCentro.icm?cdCentro=28060312,Rivas-Vaciamadrid,12300796
28060324,CEIP,"Calle Tomás Bretón, 4",022,Teresa Berganza,424799,4472870,"Colegio Infantil y Primaria CEIP Teresa Berganza. Calle Tomás Bretón, 4. Boadilla del Monte",CP INF-PRI,Colegio Infantil y Primaria,CEIP Teresa Berganza,https://gestiona.comunidad.madrid/wpad_pub/run/j/MostrarFichaCentro.icm?cdCentro=28060324,Boadilla del Monte,02200563
28060336,CEIP,"Calle Camino de La Fonda, s/n",047,Cantos Altos,415533,4498620,"Colegio Infantil y Primaria CEIP Cantos Altos. Calle Camino de La Fonda, s/n. Collado Villalba",CP INF-PRI,Colegio Infantil y Primaria,CEIP Cantos Altos,https://gestiona.comunidad.madrid/wpad_pub/run/j/MostrarFichaCentro.icm?cdCentro=28060336,Collado Villalba,047A0115
28060348,CEIPS,"Avda Atenas, 68",127,El Cantizal,421843,4485810,"Colegio Infantil, Primaria y Secundaria CEIPS El Cantizal. Avda Atenas, 68. Rozas de Madrid (Las)",CP INF-PRI-SEC,"Colegio Infantil, Primaria y Secundaria",CEIPS El Cantizal,https://gestiona.comunidad.madrid/wpad_pub/run/j/MostrarFichaCentro.icm?cdCentro=28060348,Rozas de Madrid (Las),12701060
28060351,CEIP,"Calle Raso, 6",090,El Raso,417795,4503955,"Colegio Infantil y Primaria CEIP El Raso. Calle Raso, 6. Moralzarzal",CP INF-PRI,Colegio Infantil y Primaria,CEIP El Raso,https://gestiona.comunidad.madrid/wpad_pub/run/j/MostrarFichaCentro.icm?cdCentro=28060351,Moralzarzal,090A0186
28060361,CEIP,"Plaza San Sebastián, 1",056,San Bartolomé,400883,4482274,"Colegio Infantil y Primaria CEIP San Bartolomé. Plaza San Sebastián, 1. Fresnedillas de la Oliva",CP INF-PRI,Colegio Infantil y Primaria,CEIP San Bartolomé,https://gestiona.comunidad.madrid/wpad_pub/run/j/MostrarFichaCentro.icm?cdCentro=28060361,Fresnedillas de la Oliva,05600072
28060373,IES,"Calle Pio Baroja, 7",005,Lázaro Carreter,468780,4484051,"Instituto de Educación Secundaria IES Lázaro Carreter. Calle Pio Baroja, 7. Alcalá de Henares",IES,Instituto de Educación Secundaria,IES Lázaro Carreter,https://gestiona.comunidad.madrid/wpad_pub/run/j/MostrarFichaCentro.icm?cdCentro=28060373,Alcalá de Henares,00504995
28060385,IES,"Avda Conde de Coruña, 31",053,Miguel de Cervantes,460739,4488269,"Instituto de Educación Secundaria IES Miguel de Cervantes. Avda Conde de Coruña, 31. Daganzo de Arriba",IES,Instituto de Educación Secundaria,IES Miguel de Cervantes,https://gestiona.comunidad.madrid/wpad_pub/run/j/MostrarFichaCentro.icm?cdCentro=28060385,Daganzo de Arriba,05300111
28060397,IES,"Calle Joaquín Sorolla, s/n. (Los Hueros)",172,Don Pelayo,470278,4477700,"Instituto de Educación Secundaria IES Don Pelayo. Calle Joaquín Sorolla, s/n. (Los Hueros). Villalbilla",IES,Instituto de Educación Secundaria,IES Don Pelayo,https://gestiona.comunidad.madrid/wpad_pub/run/j/MostrarFichaCentro.icm?cdCentro=28060397,Villalbilla,172A0031
28060622,EEI,"Avda Villaviciosa, 19-B",007,Rodari,429088,4467062,"Escuela de Educación Infantil EEI Rodari. Avda Villaviciosa, 19-B. Alcorcón",EEI,Escuela de Educación Infantil,EEI Rodari,https://gestiona.comunidad.madrid/wpad_pub/run/j/MostrarFichaCentro.icm?cdCentro=28060622,Alcorcón,00700346
28060634,EEI,"Calle Imago, 2",013,El Regajal,446871,4430431,"Escuela de Educación Infantil EEI El Regajal. Calle Imago, 2. Aranjuez",EEI,Escuela de Educación Infantil,EEI El Regajal,https://gestiona.comunidad.madrid/wpad_pub/run/j/MostrarFichaCentro.icm?cdCentro=28060634,Aranjuez,01301099
28060646,EEI,"Avda Isabel de Farnesio, 14",022,Achalay,424687,4472990,"Escuela de Educación Infantil EEI Achalay. Avda Isabel de Farnesio, 14. Boadilla del Monte",EEI,Escuela de Educación Infantil,EEI Achalay,https://gestiona.comunidad.madrid/wpad_pub/run/j/MostrarFichaCentro.icm?cdCentro=28060646,Boadilla del Monte,02200523
28060658,EEI,"Calle Tintes, 44",045,Los Puertos,434899,4500713,"Escuela de Educación Infantil EEI Los Puertos. Calle Tintes, 44. Colmenar Viejo",EEI,Escuela de Educación Infantil,EEI Los Puertos,https://gestiona.comunidad.madrid/wpad_pub/run/j/MostrarFichaCentro.icm?cdCentro=28060658,Colmenar Viejo,045A0482
28060661,EEI,"Calle Mayor, 29",025,Siete Estrellas,490488,4453118,"Escuela de Educación Infantil EEI Siete Estrellas. Calle Mayor, 29. Brea de Tajo",EEI-CN,Escuela de Educación Infantil,EEI Siete Estrellas,https://gestiona.comunidad.madrid/wpad_pub/run/j/MostrarFichaCentro.icm?cdCentro=28060661,Brea de Tajo,025A0064
28060671,EEI,"Avda José Fernández Segovia, 1",150,El Principito,433744,4448600,"Escuela de Educación Infantil EEI El Principito. Avda José Fernández Segovia, 1. Torrejón de Velasco",EEI-CN,Escuela de Educación Infantil,EEI El Principito,https://gestiona.comunidad.madrid/wpad_pub/run/j/MostrarFichaCentro.icm?cdCentro=28060671,Torrejón de Velasco,150A0070
28060816,IES,"Calle Floridablanca, 3",131,Padre Antonio Soler,402931,4493952,"Instituto de Educación Secundaria IES Padre Antonio Soler. Calle Floridablanca, 3. San Lorenzo de El Escorial",CIMELPR PRSEC,Instituto de Educación Secundaria,IES Padre Antonio Soler,https://gestiona.comunidad.madrid/wpad_pub/run/j/MostrarFichaCentro.icm?cdCentro=28060816,San Lorenzo de El Escorial,13100133
28060968,CEPA,"Avda Baunatal, 18 (Edificio Pablo Iglesias)",134,San Sebastián de los Reyes,446438,4489468,"Centro Educación de Adultos CEPA San Sebastián de los Reyes. Avda Baunatal, 18 (Edificio Pablo Iglesias). San Sebastián de los Reyes",CEPA,Centro Educación de Adultos,CEPA San Sebastián de los Reyes,https://gestiona.comunidad.madrid/wpad_pub/run/j/MostrarFichaCentro.icm?cdCentro=28060968,San Sebastián de los Reyes,13401673
28060971,CEPA,"Calle de la Dehesa, 23A",046,Sierra de Guadarrama,411995,4504896,"Centro Educación de Adultos CEPA Sierra de Guadarrama. Calle de la Dehesa, 23A. Collado Mediano",CEPA,Centro Educación de Adultos,CEPA Sierra de Guadarrama,https://gestiona.comunidad.madrid/wpad_pub/run/j/MostrarFichaCentro.icm?cdCentro=28060971,Collado Mediano,046A0051
28061663,EEI,"Calle Federica Montseny, 1",123,Patas Arriba,456247,4465119,"Escuela de Educación Infantil EEI Patas Arriba. Calle Federica Montseny, 1. Rivas-Vaciamadrid",EEI,Escuela de Educación Infantil,EEI Patas Arriba,https://gestiona.comunidad.madrid/wpad_pub/run/j/MostrarFichaCentro.icm?cdCentro=28061663,Rivas-Vaciamadrid,12300796
28061675,EEI,"Calle José Ruiz Azorín, 65",005,Los Molinos,469098,4484083,"Escuela de Educación Infantil EEI Los Molinos. Calle José Ruiz Azorín, 65. Alcalá de Henares",EEI,Escuela de Educación Infantil,EEI Los Molinos,https://gestiona.comunidad.madrid/wpad_pub/run/j/MostrarFichaCentro.icm?cdCentro=28061675,Alcalá de Henares,00503359
28061687,EEI,"Calle Moraña, 27",074,Dulcinea,435996,4464888,"Escuela de Educación Infantil EEI Dulcinea. Calle Moraña, 27. Leganés",EEI,Escuela de Educación Infantil,EEI Dulcinea,https://gestiona.comunidad.madrid/wpad_pub/run/j/MostrarFichaCentro.icm?cdCentro=28061687,Leganés,074A0264
28061699,EEI,"Calle Antonio Nebrija, 7",079,Las Nubes,441955,4472773,"Escuela de Educación Infantil EEI Las Nubes. Calle Antonio Nebrija, 7. Madrid",EEI,Escuela de Educación Infantil,EEI Las Nubes,https://gestiona.comunidad.madrid/wpad_pub/run/j/MostrarFichaCentro.icm?cdCentro=28061699,Madrid,07900465
28061705,EEI,"Calle Estudio, 6",079,Las Viñas,433447,4479172,"Escuela de Educación Infantil EEI Las Viñas. Calle Estudio, 6. Madrid",EEI,Escuela de Educación Infantil,EEI Las Viñas,https://gestiona.comunidad.madrid/wpad_pub/run/j/MostrarFichaCentro.icm?cdCentro=28061705,Madrid,07910759
28061717,EEI,"Calle Roquetas de Mar, 4",015,Luna Lunera,422029,4458666,"Escuela de Educación Infantil EEI Luna Lunera. Calle Roquetas de Mar, 4. Arroyomolinos",EEI-CN,Escuela de Educación Infantil,EEI Luna Lunera,https://gestiona.comunidad.madrid/wpad_pub/run/j/MostrarFichaCentro.icm?cdCentro=28061717,Arroyomolinos,01500232
28062011,IES,"Calle Alhambra de Granada, 20",013,Santiago Rusiñol,450200,4431544,"Instituto de Educación Secundaria IES Santiago Rusiñol. Calle Alhambra de Granada, 20. Aranjuez",IES,Instituto de Educación Secundaria,IES Santiago Rusiñol,https://gestiona.comunidad.madrid/wpad_pub/run/j/MostrarFichaCentro.icm?cdCentro=28062011,Aranjuez,013C0009
28062023,IES,"Avda Mar Egeo, 5",161,Maestro Matías Bravo,441289,4447783,"Instituto de Educación Secundaria IES Maestro Matías Bravo. Avda Mar Egeo, 5. Valdemoro",IES,Instituto de Educación Secundaria,IES Maestro Matías Bravo,https://gestiona.comunidad.madrid/wpad_pub/run/j/MostrarFichaCentro.icm?cdCentro=28062023,Valdemoro,16110063
28062035,IES,"Avda Hispanidad, s/n",040,Francisco Umbral,446498,4445836,"Instituto de Educación Secundaria IES Francisco Umbral. Avda Hispanidad, s/n. Ciempozuelos",IES,Instituto de Educación Secundaria,IES Francisco Umbral,https://gestiona.comunidad.madrid/wpad_pub/run/j/MostrarFichaCentro.icm?cdCentro=28062035,Ciempozuelos,040E0073
28062102,CEIP,"Calle Concepción Arenal, 17",058,Dulce Chacón,428407,4460727,"Colegio Infantil y Primaria CEIP Dulce Chacón. Calle Concepción Arenal, 17. Fuenlabrada",CP INF-PRI,Colegio Infantil y Primaria,CEIP Dulce Chacón,https://gestiona.comunidad.madrid/wpad_pub/run/j/MostrarFichaCentro.icm?cdCentro=28062102,Fuenlabrada,058A0352
28062114,CEIP,"Calle Isla Conejera, 26",073,Pedro Brimonis,429891,4456186,"Colegio Infantil y Primaria CEIP Pedro Brimonis. Calle Isla Conejera, 26. Humanes de Madrid",CP INF-PRI,Colegio Infantil y Primaria,CEIP Pedro Brimonis,https://gestiona.comunidad.madrid/wpad_pub/run/j/MostrarFichaCentro.icm?cdCentro=28062114,Humanes de Madrid,073E0041
28062126,IES,"Calle Alianza, 20-24",079,Villaverde,441705,4467654,"Instituto de Educación Secundaria IES Villaverde. Calle Alianza, 20-24. Madrid",IES,Instituto de Educación Secundaria,IES Villaverde,https://gestiona.comunidad.madrid/wpad_pub/run/j/MostrarFichaCentro.icm?cdCentro=28062126,Madrid,07911847
28062151,EA,"Avda Soto Palacios, 7",079,Carmelo Alonso Bernaola,441984,4482215,"Escuela de Educación Artística EA Carmelo Alonso Bernaola. Avda Soto Palacios, 7. Madrid",E MUN.MUSICA,Escuela de Educación Artística,EA Carmelo Alonso Bernaola,https://gestiona.comunidad.madrid/wpad_pub/run/j/MostrarFichaCentro.icm?cdCentro=28062151,Madrid,07905914
28062163,EA,Calle Huertos 90 c/v Ctra Morata de Tajuña,052,Chinchón,463580,4443313,Escuela de Educación Artística EA Chinchón. Calle Huertos 90 c/v Ctra Morata de Tajuña. Chinchón,E MUN.MUSICA,Escuela de Educación Artística,EA Chinchón,https://gestiona.comunidad.madrid/wpad_pub/run/j/MostrarFichaCentro.icm?cdCentro=28062163,Chinchón,052A0015
28062321,CEIP,"Avda José Hierro, 86",123,José Hierro,455091,4466385,"Colegio Infantil y Primaria CEIP José Hierro. Avda José Hierro, 86. Rivas-Vaciamadrid",CP INF-PRI,Colegio Infantil y Primaria,CEIP José Hierro,https://gestiona.comunidad.madrid/wpad_pub/run/j/MostrarFichaCentro.icm?cdCentro=28062321,Rivas-Vaciamadrid,123C0012
28062333,CEIP,"Calle Miralcampo, s/n",095,San Miguel,404710,4480554,"Colegio Infantil y Primaria CEIP San Miguel. Calle Miralcampo, s/n. Navalagamella",CP INF-PRI,Colegio Infantil y Primaria,CEIP San Miguel,https://gestiona.comunidad.madrid/wpad_pub/run/j/MostrarFichaCentro.icm?cdCentro=28062333,Navalagamella,095A0048
28062345,CEIP,"Calle Virgen del Rocio, s/n",119,Príncipes de Asturias,410310,4476091,"Colegio Infantil y Primaria CEIP Príncipes de Asturias. Calle Virgen del Rocio, s/n. Quijorna",CP INF-PRI,Colegio Infantil y Primaria,CEIP Príncipes de Asturias,https://gestiona.comunidad.madrid/wpad_pub/run/j/MostrarFichaCentro.icm?cdCentro=28062345,Quijorna,11900372
28062369,EOI,"Calle Orégano, 1",903,de Tres Cantos,440523,4494832,"Escuela Oficial Idiomas EOI de Tres Cantos. Calle Orégano, 1. Tres Cantos",EOI,Escuela Oficial Idiomas,EOI de Tres Cantos,https://gestiona.comunidad.madrid/wpad_pub/run/j/MostrarFichaCentro.icm?cdCentro=28062369,Tres Cantos,90300211
