CODIGO,CLAVE,DIRECCION,CMUN,DESCR,UTM_X,UTM_Y,BUSCA,DS_ABREV,DS_LARGO,ETIQUETA,URL,MUNICIPIO,CD_VIAL
28028738,CEIP,"Calle Violeta, 19",005,Beatriz Galindo,468571,4480541,"Colegio Infantil y Primaria CEIP Beatriz Galindo. Calle Violeta, 19. Alcalá de Henares",CP INF-PRI,Colegio Infantil y Primaria,CEIP Beatriz Galindo,https://gestiona.comunidad.madrid/wpad_pub/run/j/MostrarFichaCentro.icm?cdCentro=28028738,Alcalá de Henares,005A0788
28028741,CEIP,"Cuesta Teatinos, 2",005,Dulcinea,469543,4482610,"Colegio Infantil y Primaria CEIP Dulcinea. Cuesta Teatinos, 2. Alcalá de Henares",CP INF-PRI,Colegio Infantil y Primaria,CEIP Dulcinea,https://gestiona.comunidad.madrid/wpad_pub/run/j/MostrarFichaCentro.icm?cdCentro=28028741,Alcalá de Henares,005A0734
28028751,CEIP,"Avda Juan de Austria, 17",005,Juan de Austria,470202,4481984,"Colegio Infantil y Primaria CEIP Juan de Austria. Avda Juan de Austria, 17. Alcalá de Henares",CP INF-PRI,Colegio Infantil y Primaria,CEIP Juan de Austria,https://gestiona.comunidad.madrid/wpad_pub/run/j/MostrarFichaCentro.icm?cdCentro=28028751,Alcalá de Henares,005A0569
28028763,CEIP,"Avda Nuestra Señora de Belén, 6-A",005,Santos Niños,467660,4480434,"Colegio Infantil y Primaria CEIP Santos Niños. Avda Nuestra Señora de Belén, 6-A. Alcalá de Henares",CP INF-PRI,Colegio Infantil y Primaria,CEIP Santos Niños,https://gestiona.comunidad.madrid/wpad_pub/run/j/MostrarFichaCentro.icm?cdCentro=28028763,Alcalá de Henares,005A0499
28028775,CEIP,"Calle Doctor Casimiro Morcillo, 51",006,Emilio Casado,445104,4488332,"Colegio Infantil y Primaria CEIP Emilio Casado. Calle Doctor Casimiro Morcillo, 51. Alcobendas",CP INF-PRI,Colegio Infantil y Primaria,CEIP Emilio Casado,https://gestiona.comunidad.madrid/wpad_pub/run/j/MostrarFichaCentro.icm?cdCentro=28028775,Alcobendas,006A0092
28028799,CEIP,"Avda Cantarranas, 2",007,Santiago Ramón y Cajal,430032,4466973,"Colegio Infantil y Primaria CEIP Santiago Ramón y Cajal. Avda Cantarranas, 2. Alcorcón",CP INF-PRI,Colegio Infantil y Primaria,CEIP Santiago Ramón y Cajal,https://gestiona.comunidad.madrid/wpad_pub/run/j/MostrarFichaCentro.icm?cdCentro=28028799,Alcorcón,00701861
28028805,CEIP,"Calle Polvoranca, 35",007,Vicente Aleixandre,430297,4466185,"Colegio Infantil y Primaria CEIP Vicente Aleixandre. Calle Polvoranca, 35. Alcorcón",CP INF-PRI,Colegio Infantil y Primaria,CEIP Vicente Aleixandre,https://gestiona.comunidad.madrid/wpad_pub/run/j/MostrarFichaCentro.icm?cdCentro=28028805,Alcorcón,00700135
28028830,CEIP,"Calle Frailes, 6",074,Francisco de Quevedo,434368,4463829,"Colegio Infantil y Primaria CEIP Francisco de Quevedo. Calle Frailes, 6. Leganés",CP INF-PRI,Colegio Infantil y Primaria,CEIP Francisco de Quevedo,https://gestiona.comunidad.madrid/wpad_pub/run/j/MostrarFichaCentro.icm?cdCentro=28028830,Leganés,074A0158
28028842,CEIP,"Avda los Pinos, 4",074,Lope de Vega,434189,4463929,"Colegio Infantil y Primaria CEIP Lope de Vega. Avda los Pinos, 4. Leganés",CP INF-PRI,Colegio Infantil y Primaria,CEIP Lope de Vega,https://gestiona.comunidad.madrid/wpad_pub/run/j/MostrarFichaCentro.icm?cdCentro=28028842,Leganés,074A0323
28028854,CEIP,"Calle Zipaquira, 14",079,Dionisio Ridruejo,446211,4480452,"Colegio Infantil y Primaria CEIP Dionisio Ridruejo. Calle Zipaquira, 14. Madrid",CP INF-PRI,Colegio Infantil y Primaria,CEIP Dionisio Ridruejo,https://gestiona.comunidad.madrid/wpad_pub/run/j/MostrarFichaCentro.icm?cdCentro=28028854,Madrid,07908942
28028891,CEIP,"Calle Río Ebro, 9",092,Las Cumbres,425547,4463065,"Colegio Infantil y Primaria CEIP Las Cumbres. Calle Río Ebro, 9. Móstoles",CP INF-PRI,Colegio Infantil y Primaria,CEIP Las Cumbres,https://gestiona.comunidad.madrid/wpad_pub/run/j/MostrarFichaCentro.icm?cdCentro=28028891,Móstoles,092A0314
28028945,CEIP,"Calle Juan Ramón Jiménez, 8",148,Juan Ramón Jiménez,459517,4479502,"Colegio Infantil y Primaria CEIP Juan Ramón Jiménez. Calle Juan Ramón Jiménez, 8. Torrejón de Ardoz",CP INF-PRI,Colegio Infantil y Primaria,CEIP Juan Ramón Jiménez,https://gestiona.comunidad.madrid/wpad_pub/run/j/MostrarFichaCentro.icm?cdCentro=28028945,Torrejón de Ardoz,14800130
28029111,CEIP,"Ctra Colmenar Viejo, Km 15 (Calle Kant, 2)",079,Príncipe de Asturias,440998,4488100,"Colegio Infantil y Primaria CEIP Príncipe de Asturias. Ctra Colmenar Viejo, Km 15 (Calle Kant, 2). Madrid",CP INF-PRI,Colegio Infantil y Primaria,CEIP Príncipe de Asturias,https://gestiona.comunidad.madrid/wpad_pub/run/j/MostrarFichaCentro.icm?cdCentro=28029111,Madrid,079C1611
28029123,CEIP,"Calle Camino Viejo de Villaverde, 1",079,Meseta de Orcasitas,439688,4469280,"Colegio Infantil y Primaria CEIP Meseta de Orcasitas. Calle Camino Viejo de Villaverde, 1. Madrid",CP INF-PRI,Colegio Infantil y Primaria,CEIP Meseta de Orcasitas,https://gestiona.comunidad.madrid/wpad_pub/run/j/MostrarFichaCentro.icm?cdCentro=28029123,Madrid,07945602
28029160,CEIP,"Paseo Pinar, 2",127,San Miguel,426163,4483115,"Colegio Infantil y Primaria CEIP San Miguel. Paseo Pinar, 2. Rozas de Madrid (Las)",CP INF-PRI,Colegio Infantil y Primaria,CEIP San Miguel,https://gestiona.comunidad.madrid/wpad_pub/run/j/MostrarFichaCentro.icm?cdCentro=28029160,Rozas de Madrid (Las),12702470
28029238,CEIP,"Calle Felipe de Diego, 6",079,Palomeras Bajas,443902,4470050,"Colegio Infantil y Primaria CEIP Palomeras Bajas. Calle Felipe de Diego, 6. Madrid",CP INF-PRI,Colegio Infantil y Primaria,CEIP Palomeras Bajas,https://gestiona.comunidad.madrid/wpad_pub/run/j/MostrarFichaCentro.icm?cdCentro=28029238,Madrid,07911221
28029241,CEE,"Avda Mediterráneo, km. 7 (Avda del Campus Sur)",079,Vallecas,446399,4471054,"Centro de Educación Especial CEE Vallecas. Avda Mediterráneo, km. 7 (Avda del Campus Sur). Madrid",CP EE,Centro de Educación Especial,CEE Vallecas,https://gestiona.comunidad.madrid/wpad_pub/run/j/MostrarFichaCentro.icm?cdCentro=28029241,Madrid,079C0640
28029512,CEIP,"Calle Salcillo, 4",092,Salzillo - Valle Inclán,426664,4465256,"Colegio Infantil y Primaria CEIP Salzillo - Valle Inclán. Calle Salcillo, 4. Móstoles",CP INF-PRI,Colegio Infantil y Primaria,CEIP Salzillo - Valle Inclán,https://gestiona.comunidad.madrid/wpad_pub/run/j/MostrarFichaCentro.icm?cdCentro=28029512,Móstoles,092A0337
28029597,CEIP,"Calle Santiago Rusiñol, 7",013,San Fernando,447819,4431328,"Colegio Infantil y Primaria CEIP San Fernando. Calle Santiago Rusiñol, 7. Aranjuez",CP INF-PRI,Colegio Infantil y Primaria,CEIP San Fernando,https://gestiona.comunidad.madrid/wpad_pub/run/j/MostrarFichaCentro.icm?cdCentro=28029597,Aranjuez,013A0271
28029603,CEIP,"Plaza Paloma, 11",013,Santa Teresa de Jesús,447431,4430989,"Colegio Infantil y Primaria CEIP Santa Teresa de Jesús. Plaza Paloma, 11. Aranjuez",CP INF-PRI,Colegio Infantil y Primaria,CEIP Santa Teresa de Jesús,https://gestiona.comunidad.madrid/wpad_pub/run/j/MostrarFichaCentro.icm?cdCentro=28029603,Aranjuez,013A0191
28029615,CEIP,"Calle Suiza, 24",058,Miguel Hernández,431716,4459662,"Colegio Infantil y Primaria CEIP Miguel Hernández. Calle Suiza, 24. Fuenlabrada",CP INF-PRI,Colegio Infantil y Primaria,CEIP Miguel Hernández,https://gestiona.comunidad.madrid/wpad_pub/run/j/MostrarFichaCentro.icm?cdCentro=28029615,Fuenlabrada,058A0459
28029652,CEIP,"Calle Alemania, 18",058,Francisco de Quevedo,431285,4459871,"Colegio Infantil y Primaria CEIP Francisco de Quevedo. Calle Alemania, 18. Fuenlabrada",CP INF-PRI,Colegio Infantil y Primaria,CEIP Francisco de Quevedo,https://gestiona.comunidad.madrid/wpad_pub/run/j/MostrarFichaCentro.icm?cdCentro=28029652,Fuenlabrada,058A0016
28029664,CEE,"Calle Saldaña, 30",079,Inmaculada Concepción,438378,4471300,"Centro de Educación Especial CEE Inmaculada Concepción. Calle Saldaña, 30. Madrid",CP EE,Centro de Educación Especial,CEE Inmaculada Concepción,https://gestiona.comunidad.madrid/wpad_pub/run/j/MostrarFichaCentro.icm?cdCentro=28029664,Madrid,07905329
28029691,CEIP,"Calle Francisco de Goya, 3",084,Miguel de Cervantes,459214,4471430,"Colegio Infantil y Primaria CEIP Miguel de Cervantes. Calle Francisco de Goya, 3. Mejorada del Campo",CP INF-PRI,Colegio Infantil y Primaria,CEIP Miguel de Cervantes,https://gestiona.comunidad.madrid/wpad_pub/run/j/MostrarFichaCentro.icm?cdCentro=28029691,Mejorada del Campo,08400049
28029901,CEIP,"Avda España, 16",049,Gonzalo de Berceo,452091,4474684,"Colegio Infantil y Primaria CEIP Gonzalo de Berceo. Avda España, 16. Coslada",CP INF-PRI,Colegio Infantil y Primaria,CEIP Gonzalo de Berceo,https://gestiona.comunidad.madrid/wpad_pub/run/j/MostrarFichaCentro.icm?cdCentro=28029901,Coslada,049A0101
28029913,CEIP,"Avda España, 144",049,Menéndez Pidal,453294,4474685,"Colegio Infantil y Primaria CEIP Menéndez Pidal. Avda España, 144. Coslada",CP INF-PRI,Colegio Infantil y Primaria,CEIP Menéndez Pidal,https://gestiona.comunidad.madrid/wpad_pub/run/j/MostrarFichaCentro.icm?cdCentro=28029913,Coslada,049A0101
28029937,CEIP,"Calle Cañada Real de Toledo, 24",113,Buenos Aires,440372,4454173,"Colegio Infantil y Primaria CEIP Buenos Aires. Calle Cañada Real de Toledo, 24. Pinto",CP INF-PRI,Colegio Infantil y Primaria,CEIP Buenos Aires,https://gestiona.comunidad.madrid/wpad_pub/run/j/MostrarFichaCentro.icm?cdCentro=28029937,Pinto,113A0052
28030101,CEPA,"Calle Guadalajara, 3",065,Casa de la Cultura,437768,4461961,"Centro Educación de Adultos CEPA Casa de la Cultura. Calle Guadalajara, 3. Getafe",CEPA,Centro Educación de Adultos,CEPA Casa de la Cultura,https://gestiona.comunidad.madrid/wpad_pub/run/j/MostrarFichaCentro.icm?cdCentro=28030101,Getafe,065A0357
28030113,CEPA,"Calle Corregidor Alonso de Tobar, 7",079,Cultural Moratalaz,444874,4472815,"Centro Educación de Adultos CEPA Cultural Moratalaz. Calle Corregidor Alonso de Tobar, 7. Madrid",CEPA,Centro Educación de Adultos,CEPA Cultural Moratalaz,https://gestiona.comunidad.madrid/wpad_pub/run/j/MostrarFichaCentro.icm?cdCentro=28030113,Madrid,07900600
28030125,CEPA,"Calle Ocaña, 35 B",079,Aluche,435923,4470762,"Centro Educación de Adultos CEPA Aluche. Calle Ocaña, 35 B. Madrid",CEPA,Centro Educación de Adultos,CEPA Aluche,https://gestiona.comunidad.madrid/wpad_pub/run/j/MostrarFichaCentro.icm?cdCentro=28030125,Madrid,07908809
28030137,IES,"Calle Fortuny, 24",079,Fortuny,441483,4476130,"Instituto de Educación Secundaria IES Fortuny. Calle Fortuny, 24. Madrid",IES,Instituto de Educación Secundaria,IES Fortuny,https://gestiona.comunidad.madrid/wpad_pub/run/j/MostrarFichaCentro.icm?cdCentro=28030137,Madrid,07902251
28030149,IES,"Calle Valdesangil, 25",079,Ciudad de los Poetas,439144,4479918,"Instituto de Educación Secundaria IES Ciudad de los Poetas. Calle Valdesangil, 25. Madrid",IES,Instituto de Educación Secundaria,IES Ciudad de los Poetas,https://gestiona.comunidad.madrid/wpad_pub/run/j/MostrarFichaCentro.icm?cdCentro=28030149,Madrid,07910388
28030150,IES,"Avda Manoteras, 55",079,Ramón y Cajal,444059,4482067,"Instituto de Educación Secundaria IES Ramón y Cajal. Avda Manoteras, 55. Madrid",IES,Instituto de Educación Secundaria,IES Ramón y Cajal,https://gestiona.comunidad.madrid/wpad_pub/run/j/MostrarFichaCentro.icm?cdCentro=28030150,Madrid,07910535
28030162,IES,"Calle Villaescusa, 17",079,Miguel Delibes,446432,4474808,"Instituto de Educación Secundaria IES Miguel Delibes. Calle Villaescusa, 17. Madrid",IES,Instituto de Educación Secundaria,IES Miguel Delibes,https://gestiona.comunidad.madrid/wpad_pub/run/j/MostrarFichaCentro.icm?cdCentro=28030162,Madrid,07906377
28030174,IES,"Calle Huerta de Villaverde, 15",079,Celestino Mutis,439450,4466651,"Instituto de Educación Secundaria IES Celestino Mutis. Calle Huerta de Villaverde, 15. Madrid",IES,Instituto de Educación Secundaria,IES Celestino Mutis,https://gestiona.comunidad.madrid/wpad_pub/run/j/MostrarFichaCentro.icm?cdCentro=28030174,Madrid,07911225
28030186,IES,"Calle Alfredo Marquerie, 21",079,Dámaso Alonso,440628,4482067,"Instituto de Educación Secundaria IES Dámaso Alonso. Calle Alfredo Marquerie, 21. Madrid",IES,Instituto de Educación Secundaria,IES Dámaso Alonso,https://gestiona.comunidad.madrid/wpad_pub/run/j/MostrarFichaCentro.icm?cdCentro=28030186,Madrid,07910814
28030198,CEIP,"Calle Fermín Caballero, 68",079,Cardenal Herrera Oria,439705,4481573,"Colegio Infantil y Primaria CEIP Cardenal Herrera Oria. Calle Fermín Caballero, 68. Madrid",CP INF-PRI,Colegio Infantil y Primaria,CEIP Cardenal Herrera Oria,https://gestiona.comunidad.madrid/wpad_pub/run/j/MostrarFichaCentro.icm?cdCentro=28030198,Madrid,07910346
28030204,CEPA,"Calle Camino de Humanes, 63",092,Agustina de Aragón,427302,4462701,"Centro Educación de Adultos CEPA Agustina de Aragón. Calle Camino de Humanes, 63. Móstoles",CEPA,Centro Educación de Adultos,CEPA Agustina de Aragón,https://gestiona.comunidad.madrid/wpad_pub/run/j/MostrarFichaCentro.icm?cdCentro=28030204,Móstoles,092A0057
28030216,IES,"Avda Juan Carlos I, 19",106,Humanejos,434640,4453265,"Instituto de Educación Secundaria IES Humanejos. Avda Juan Carlos I, 19. Parla",IES,Instituto de Educación Secundaria,IES Humanejos,https://gestiona.comunidad.madrid/wpad_pub/run/j/MostrarFichaCentro.icm?cdCentro=28030216,Parla,10600720
28030228,IES,"Calle San Fernando, 4",148,León Felipe,458645,4479126,"Instituto de Educación Secundaria IES León Felipe. Calle San Fernando, 4. Torrejón de Ardoz",IES,Instituto de Educación Secundaria,IES León Felipe,https://gestiona.comunidad.madrid/wpad_pub/run/j/MostrarFichaCentro.icm?cdCentro=28030228,Torrejón de Ardoz,14801514
28030241,IES,"Avda Pablo Iglesias, 3",007,Prado de Santo Domingo,428582,4465880,"Instituto de Educación Secundaria IES Prado de Santo Domingo. Avda Pablo Iglesias, 3. Alcorcón",IES,Instituto de Educación Secundaria,IES Prado de Santo Domingo,https://gestiona.comunidad.madrid/wpad_pub/run/j/MostrarFichaCentro.icm?cdCentro=28030241,Alcorcón,00701854
28030344,CEIP,"Avda Ejército, 5",005,Manuel Azaña,468038,4481009,"Colegio Infantil y Primaria CEIP Manuel Azaña. Avda Ejército, 5. Alcalá de Henares",CP INF-PRI,Colegio Infantil y Primaria,CEIP Manuel Azaña,https://gestiona.comunidad.madrid/wpad_pub/run/j/MostrarFichaCentro.icm?cdCentro=28030344,Alcalá de Henares,005A0377
28030368,CEIP,"Calle Río Guadarrama, 1",005,Iplacea,469235,4480529,"Colegio Infantil y Primaria CEIP Iplacea. Calle Río Guadarrama, 1. Alcalá de Henares",CP INF-PRI,Colegio Infantil y Primaria,CEIP Iplacea,https://gestiona.comunidad.madrid/wpad_pub/run/j/MostrarFichaCentro.icm?cdCentro=28030368,Alcalá de Henares,005A0617
28030371,CEIP,"Calle Isla de Sálvora, 155",047,Maríano Benlliure,413845,4497333,"Colegio Infantil y Primaria CEIP Maríano Benlliure. Calle Isla de Sálvora, 155. Collado Villalba",CP INF-PRI,Colegio Infantil y Primaria,CEIP Maríano Benlliure,https://gestiona.comunidad.madrid/wpad_pub/run/j/MostrarFichaCentro.icm?cdCentro=28030371,Collado Villalba,047A0151
28030381,CEIP,"Avda Reina Sofía, 42",074,Antonio Machado,436803,4466030,"Colegio Infantil y Primaria CEIP Antonio Machado. Avda Reina Sofía, 42. Leganés",CP INF-PRI,Colegio Infantil y Primaria,CEIP Antonio Machado,https://gestiona.comunidad.madrid/wpad_pub/run/j/MostrarFichaCentro.icm?cdCentro=28030381,Leganés,074A0368
28030393,CEIP,"Calle Dinamarca, 11",074,Federico García Lorca,436915,4465729,"Colegio Infantil y Primaria CEIP Federico García Lorca. Calle Dinamarca, 11. Leganés",CP INF-PRI,Colegio Infantil y Primaria,CEIP Federico García Lorca,https://gestiona.comunidad.madrid/wpad_pub/run/j/MostrarFichaCentro.icm?cdCentro=28030393,Leganés,074A0122
28030401,CEIP,"Calle Parque de La Paloma, 9",079,Pradolongo,439187,4470075,"Colegio Infantil y Primaria CEIP Pradolongo. Calle Parque de La Paloma, 9. Madrid",CP INF-PRI,Colegio Infantil y Primaria,CEIP Pradolongo,https://gestiona.comunidad.madrid/wpad_pub/run/j/MostrarFichaCentro.icm?cdCentro=28030401,Madrid,07904510
28030411,CEIP,"Calle Forges, 15B",079,Vicálvaro,448959,4472896,"Colegio Infantil y Primaria CEIP Vicálvaro. Calle Forges, 15B. Madrid",CP INF-PRI,Colegio Infantil y Primaria,CEIP Vicálvaro,https://gestiona.comunidad.madrid/wpad_pub/run/j/MostrarFichaCentro.icm?cdCentro=28030411,Madrid,07908922
28030435,CEIP,"Avda Valencia, 5",134,San Sebastián,446613,4489680,"Colegio Infantil y Primaria CEIP San Sebastián. Avda Valencia, 5. San Sebastián de los Reyes",CP INF-PRI,Colegio Infantil y Primaria,CEIP San Sebastián,https://gestiona.comunidad.madrid/wpad_pub/run/j/MostrarFichaCentro.icm?cdCentro=28030435,San Sebastián de los Reyes,13401403
28030447,CEIP,"Calle Barberán y Collar, 21",005,Ciudad del Aire,470841,4483252,"Colegio Infantil y Primaria CEIP Ciudad del Aire. Calle Barberán y Collar, 21. Alcalá de Henares",CP INF-PRI,Colegio Infantil y Primaria,CEIP Ciudad del Aire,https://gestiona.comunidad.madrid/wpad_pub/run/j/MostrarFichaCentro.icm?cdCentro=28030447,Alcalá de Henares,005A0079
28030472,CEIP,"Calle Sorzano, 1",079,San Juan Bautista,444107,4478049,"Colegio Infantil y Primaria CEIP San Juan Bautista. Calle Sorzano, 1. Madrid",CP INF-PRI,Colegio Infantil y Primaria,CEIP San Juan Bautista,https://gestiona.comunidad.madrid/wpad_pub/run/j/MostrarFichaCentro.icm?cdCentro=28030472,Madrid,07905911
28030575,IES,"Calle Somontín, 59",079,Arturo Soria,444036,4480993,"Instituto de Educación Secundaria IES Arturo Soria. Calle Somontín, 59. Madrid",IES,Instituto de Educación Secundaria,IES Arturo Soria,https://gestiona.comunidad.madrid/wpad_pub/run/j/MostrarFichaCentro.icm?cdCentro=28030575,Madrid,07905900
28030824,CEIP,"Calle Constitución, 127",006,Valdepalitos,445257,4488822,"Colegio Infantil y Primaria CEIP Valdepalitos. Calle Constitución, 127. Alcobendas",CP INF-PRI,Colegio Infantil y Primaria,CEIP Valdepalitos,https://gestiona.comunidad.madrid/wpad_pub/run/j/MostrarFichaCentro.icm?cdCentro=28030824,Alcobendas,006A0078
28030836,CEIP,"Calle Olímpico Francisco Fernández Ochoa, 6",007,Federico García Lorca,430385,4465772,"Colegio Infantil y Primaria CEIP Federico García Lorca. Calle Olímpico Francisco Fernández Ochoa, 6. Alcorcón",CP INF-PRI,Colegio Infantil y Primaria,CEIP Federico García Lorca,https://gestiona.comunidad.madrid/wpad_pub/run/j/MostrarFichaCentro.icm?cdCentro=28030836,Alcorcón,00702380
28030848,CEIP,"Avda Niño Jesus, 1",014,Federico García Lorca,459399,4462898,"Colegio Infantil y Primaria CEIP Federico García Lorca. Avda Niño Jesus, 1. Arganda del Rey",CP INF-PRI,Colegio Infantil y Primaria,CEIP Federico García Lorca,https://gestiona.comunidad.madrid/wpad_pub/run/j/MostrarFichaCentro.icm?cdCentro=28030848,Arganda del Rey,014A0276
28030903,IES,"Avda Ejército,89",005,Mateo Alemán,467591,4480919,"Instituto de Educación Secundaria IES Mateo Alemán. Avda Ejército,89. Alcalá de Henares",IES,Instituto de Educación Secundaria,IES Mateo Alemán,https://gestiona.comunidad.madrid/wpad_pub/run/j/MostrarFichaCentro.icm?cdCentro=28030903,Alcalá de Henares,005A0232
28030915,IES,"Avda Retamas, 2",007,Galileo Galilei,428726,4465829,"Instituto de Educación Secundaria IES Galileo Galilei. Avda Retamas, 2. Alcorcón",IES,Instituto de Educación Secundaria,IES Galileo Galilei,https://gestiona.comunidad.madrid/wpad_pub/run/j/MostrarFichaCentro.icm?cdCentro=28030915,Alcorcón,00702573
28030927,IES,"Calle Maqueda, 130",079,Blas de Otero,435283,4471219,"Instituto de Educación Secundaria IES Blas de Otero. Calle Maqueda, 130. Madrid",IES,Instituto de Educación Secundaria,IES Blas de Otero,https://gestiona.comunidad.madrid/wpad_pub/run/j/MostrarFichaCentro.icm?cdCentro=28030927,Madrid,07908674
28030939,IES,"Calle Beneficencia, 4",079,San Mateo,440628,4475241,"Instituto de Educación Secundaria IES San Mateo. Calle Beneficencia, 4. Madrid",IES,Instituto de Educación Secundaria,IES San Mateo,https://gestiona.comunidad.madrid/wpad_pub/run/j/MostrarFichaCentro.icm?cdCentro=28030939,Madrid,07900796
28030952,IES,"Calle Alcalde Garrido Juaristi, 6",079,Mariana Pineda,444370,4473880,"Instituto de Educación Secundaria IES Mariana Pineda. Calle Alcalde Garrido Juaristi, 6. Madrid",IES,Instituto de Educación Secundaria,IES Mariana Pineda,https://gestiona.comunidad.madrid/wpad_pub/run/j/MostrarFichaCentro.icm?cdCentro=28030952,Madrid,07911184
28030964,IES,"Calle Antonio Folgueras, 27",079,Vallecas - Magerit,443906,4471148,"Instituto de Educación Secundaria IES Vallecas - Magerit. Calle Antonio Folgueras, 27. Madrid",IES,Instituto de Educación Secundaria,IES Vallecas - Magerit,https://gestiona.comunidad.madrid/wpad_pub/run/j/MostrarFichaCentro.icm?cdCentro=28030964,Madrid,07900446
28030976,IES,"Calle Carlos II, 1",079,Las Musas,448419,4475449,"Instituto de Educación Secundaria IES Las Musas. Calle Carlos II, 1. Madrid",IES,Instituto de Educación Secundaria,IES Las Musas,https://gestiona.comunidad.madrid/wpad_pub/run/j/MostrarFichaCentro.icm?cdCentro=28030976,Madrid,07945316
28030991,IES,"Calle Villaescusa, 19",079,Barrio de Bilbao,446502,4474699,"Instituto de Educación Secundaria IES Barrio de Bilbao. Calle Villaescusa, 19. Madrid",CP IFP,Instituto de Educación Secundaria,IES Barrio de Bilbao,https://gestiona.comunidad.madrid/wpad_pub/run/j/MostrarFichaCentro.icm?cdCentro=28030991,Madrid,07906377
28031002,IES,"Calle General Romero Basart, 90",079,Leonardo Da Vinci,435110,4469967,"Instituto de Educación Secundaria IES Leonardo Da Vinci. Calle General Romero Basart, 90. Madrid",IES,Instituto de Educación Secundaria,IES Leonardo Da Vinci,https://gestiona.comunidad.madrid/wpad_pub/run/j/MostrarFichaCentro.icm?cdCentro=28031002,Madrid,07907659
28031014,IES,"Calle Corregidor Diego de Valderrábano, 35",079,Moratalaz,444129,4473786,"Instituto de Educación Secundaria IES Moratalaz. Calle Corregidor Diego de Valderrábano, 35. Madrid",IES,Instituto de Educación Secundaria,IES Moratalaz,https://gestiona.comunidad.madrid/wpad_pub/run/j/MostrarFichaCentro.icm?cdCentro=28031014,Madrid,07908943
28031026,CEIP,"Calle Doctor Marañón, 7",014,Miguel Hernández,462771,4461592,"Colegio Infantil y Primaria CEIP Miguel Hernández. Calle Doctor Marañón, 7. Arganda del Rey",CP INF-PRI,Colegio Infantil y Primaria,CEIP Miguel Hernández,https://gestiona.comunidad.madrid/wpad_pub/run/j/MostrarFichaCentro.icm?cdCentro=28031026,Arganda del Rey,014A0114
28031038,CEIP,"Calle Yugoslavia, 10",074,Luis de Góngora,437044,4465256,"Colegio Infantil y Primaria CEIP Luis de Góngora. Calle Yugoslavia, 10. Leganés",CP INF-PRI,Colegio Infantil y Primaria,CEIP Luis de Góngora,https://gestiona.comunidad.madrid/wpad_pub/run/j/MostrarFichaCentro.icm?cdCentro=28031038,Leganés,074A0522
28031041,CEIP,"Paseo Ermita, 19",074,Gerardo Diego,434939,4465839,"Colegio Infantil y Primaria CEIP Gerardo Diego. Paseo Ermita, 19. Leganés",CP INF-PRI,Colegio Infantil y Primaria,CEIP Gerardo Diego,https://gestiona.comunidad.madrid/wpad_pub/run/j/MostrarFichaCentro.icm?cdCentro=28031041,Leganés,074A0207
28031051,CEIP,"Calle Fragata, 33",079,Miguel Servet,437444,4471737,"Colegio Infantil y Primaria CEIP Miguel Servet. Calle Fragata, 33. Madrid",CP INF-PRI,Colegio Infantil y Primaria,CEIP Miguel Servet,https://gestiona.comunidad.madrid/wpad_pub/run/j/MostrarFichaCentro.icm?cdCentro=28031051,Madrid,07902256
28031063,CEIP,"Calle Ginzo de Limia, 2 A",079,Breogán,440472,4480785,"Colegio Infantil y Primaria CEIP Breogán. Calle Ginzo de Limia, 2 A. Madrid",CP INF-PRI,Colegio Infantil y Primaria,CEIP Breogán,https://gestiona.comunidad.madrid/wpad_pub/run/j/MostrarFichaCentro.icm?cdCentro=28031063,Madrid,07909113
28031075,CEIP,"Avda Manoteras, 41",079,Virgen del Cortijo,443733,4482148,"Colegio Infantil y Primaria CEIP Virgen del Cortijo. Avda Manoteras, 41. Madrid",CP INF-PRI,Colegio Infantil y Primaria,CEIP Virgen del Cortijo,https://gestiona.comunidad.madrid/wpad_pub/run/j/MostrarFichaCentro.icm?cdCentro=28031075,Madrid,07910535
28031087,CEIP,"Calle Juan Esplandiu, 2-A",079,Ciudad de Roma,443541,4474078,"Colegio Infantil y Primaria CEIP Ciudad de Roma. Calle Juan Esplandiu, 2-A. Madrid",CP INF-PRI,Colegio Infantil y Primaria,CEIP Ciudad de Roma,https://gestiona.comunidad.madrid/wpad_pub/run/j/MostrarFichaCentro.icm?cdCentro=28031087,Madrid,07910840
28031099,CEIP,"Calle Maqueda, 130",079,La Latina,435280,4471172,"Colegio Infantil y Primaria CEIP La Latina. Calle Maqueda, 130. Madrid",CP INF-PRI,Colegio Infantil y Primaria,CEIP La Latina,https://gestiona.comunidad.madrid/wpad_pub/run/j/MostrarFichaCentro.icm?cdCentro=28031099,Madrid,07908674
28031130,CEIP,"Calle Pintor Velázquez, 20",092,Blas de Otero,425757,4464853,"Colegio Infantil y Primaria CEIP Blas de Otero. Calle Pintor Velázquez, 20. Móstoles",CP INF-PRI,Colegio Infantil y Primaria,CEIP Blas de Otero,https://gestiona.comunidad.madrid/wpad_pub/run/j/MostrarFichaCentro.icm?cdCentro=28031130,Móstoles,092A0294
28031142,CEIP,"Avda Italia, 1",115,Pinar Prados de Torrejón,432433,4478042,"Colegio Infantil y Primaria CEIP Pinar Prados de Torrejón. Avda Italia, 1. Pozuelo de Alarcón",CP INF-PRI,Colegio Infantil y Primaria,CEIP Pinar Prados de Torrejón,https://gestiona.comunidad.madrid/wpad_pub/run/j/MostrarFichaCentro.icm?cdCentro=28031142,Pozuelo de Alarcón,115A0370
28031166,CEIP,"Avda Valencia, 7",134,León Felipe,446644,4489854,"Colegio Infantil y Primaria CEIP León Felipe. Avda Valencia, 7. San Sebastián de los Reyes",CP INF-PRI,Colegio Infantil y Primaria,CEIP León Felipe,https://gestiona.comunidad.madrid/wpad_pub/run/j/MostrarFichaCentro.icm?cdCentro=28031166,San Sebastián de los Reyes,13401403
28031211,CEIP,"Avda Andalucía, 55",045,Fuentesanta,434128,4502587,"Colegio Infantil y Primaria CEIP Fuentesanta. Avda Andalucía, 55. Colmenar Viejo",CP INF-PRI,Colegio Infantil y Primaria,CEIP Fuentesanta,https://gestiona.comunidad.madrid/wpad_pub/run/j/MostrarFichaCentro.icm?cdCentro=28031211,Colmenar Viejo,045A0019
